{
  "$schema": "http://json-schema.org/draft-07/schema#",
  "$id": "https://compliancetoarchitecture.com/schemas/risk-register-link.schema.json",
  "title": "RiskRegisterLink",
  "description": "Binds a Control to a Risk Scenario in the tenant's risk register with the residual-risk + mitigation posture the control provides. Materialises the Control → Risk edge so audit packs can answer 'which risks does this control mitigate, and what residual risk remains?'.",
  "type": "object",
  "additionalProperties": false,
  "required": [
    "risk_link_id",
    "risk_scenario_id",
    "control_id",
    "tenant_id",
    "mitigation_kind",
    "inherent_likelihood",
    "inherent_impact",
    "residual_likelihood",
    "residual_impact",
    "established_at",
    "owner_role"
  ],
  "properties": {
    "risk_link_id": {
      "type": "string",
      "description": "Stable identifier. Convention RLNK-<TOPIC>-NNN.",
      "pattern": "^RLNK-[A-Z0-9]+(-[A-Z0-9]+)+-[0-9]{3}$"
    },
    "risk_scenario_id": {
      "type": "string",
      "description": "Identifier of the Risk Scenario being mitigated (matches the tenant's risk register convention)."
    },
    "control_id": {
      "type": "string",
      "description": "Control that mitigates the risk.",
      "pattern": "^CTRL-[A-Z0-9-]+$"
    },
    "tenant_id": {
      "type": "string",
      "description": "Owner tenant. Cross-tenant references forbidden by Cerbos policy."
    },
    "mitigation_kind": {
      "type": "string",
      "enum": ["preventative", "detective", "corrective", "compensating", "deterrent"],
      "description": "How the control mitigates this specific risk."
    },
    "inherent_likelihood": {
      "type": "string",
      "enum": ["rare", "unlikely", "possible", "likely", "almost-certain"],
      "description": "Likelihood BEFORE the control operates."
    },
    "inherent_impact": {
      "type": "string",
      "enum": ["negligible", "minor", "moderate", "major", "catastrophic"],
      "description": "Impact BEFORE the control operates."
    },
    "residual_likelihood": {
      "type": "string",
      "enum": ["rare", "unlikely", "possible", "likely", "almost-certain"],
      "description": "Likelihood AFTER the control operates effectively."
    },
    "residual_impact": {
      "type": "string",
      "enum": ["negligible", "minor", "moderate", "major", "catastrophic"],
      "description": "Impact AFTER the control operates effectively."
    },
    "residual_risk_acceptance": {
      "type": "string",
      "enum": ["accepted", "transferred", "avoided", "further-reduce-planned"],
      "description": "Treatment decision for the residual risk."
    },
    "established_at": {
      "type": "string",
      "format": "date-time",
      "description": "When the binding was established."
    },
    "last_reviewed_at": {
      "type": "string",
      "format": "date-time",
      "description": "When the binding was last re-validated."
    },
    "owner_role": {
      "type": "string",
      "description": "Role that owns the binding (Cerbos snake_case convention)."
    },
    "notes": {
      "type": "string",
      "description": "Free-text operational notes."
    }
  }
}
